{
  "sap_version": "2026-10-21-draft",
  "kind": "sap.offer",
  "id": "offer-local-1",
  "exchange_id": "exchange-1",
  "created_at": "2026-10-21T14:00:00Z",
  "operation": {
    "task_class": "text.summarization",
    "sensitivity": "confidential"
  },
  "payload": {
    "option_id": "ondevice-model",
    "locality": "on_device",
    "human_review_available": true,
    "metrics": {
      "energy_kwh": {
        "value": 0.0007,
        "unit": "kWh",
        "basis": "estimated",
        "source": "fixture:meter-assumption",
        "scope": "local device, illustrative token workload"
      },
      "carbon_gco2e": {
        "value": null,
        "unit": "gCO2e",
        "basis": "unknown",
        "source": null,
        "scope": "not observed"
      },
      "cost_usd": {
        "value": 0.01,
        "unit": "USD",
        "basis": "estimated",
        "source": "fixture:cost-model",
        "scope": "illustrative per task"
      },
      "latency_ms": {
        "value": 560,
        "unit": "ms",
        "basis": "measured",
        "source": "fixture:monotonic-clock",
        "scope": "synthetic instrumentation test only"
      },
      "quality_proxy": {
        "value": 0.91,
        "unit": "ratio",
        "basis": "estimated",
        "source": "fixture:evaluation",
        "scope": "synthetic evaluation"
      }
    }
  }
}
