{
  "sap_version": "2026-10-21-draft",
  "kind": "sap.decision",
  "id": "decision-1",
  "exchange_id": "exchange-1",
  "created_at": "2026-10-21T14:00:01Z",
  "operation": {
    "task_class": "text.summarization",
    "sensitivity": "confidential"
  },
  "payload": {
    "selected_offer_id": "offer-local-1",
    "policy": {
      "mode": "balanced",
      "min_quality": 0.85,
      "local_only": true,
      "human_review_required": false
    },
    "reason_code": "selected",
    "provisional": true
  }
}
