{
  "sap_version": "2026-10-21-draft",
  "kind": "sap.receipt",
  "id": "receipt-1",
  "exchange_id": "exchange-1",
  "created_at": "2026-10-21T14:00:03Z",
  "operation": {
    "task_class": "text.summarization",
    "sensitivity": "confidential"
  },
  "payload": {
    "offer_id": "offer-local-1",
    "status": "reported",
    "metrics": {
      "energy_kwh": {
        "value": null,
        "unit": "kWh",
        "basis": "unknown",
        "source": null,
        "scope": "not observed"
      },
      "carbon_gco2e": {
        "value": null,
        "unit": "gCO2e",
        "basis": "unknown",
        "source": null,
        "scope": "not observed"
      },
      "cost_usd": {
        "value": 0.01,
        "unit": "USD",
        "basis": "estimated",
        "source": "fixture:cost-model",
        "scope": "illustrative per task"
      },
      "latency_ms": {
        "value": 560,
        "unit": "ms",
        "basis": "measured",
        "source": "fixture:monotonic-clock",
        "scope": "synthetic instrumentation test only"
      },
      "quality_proxy": {
        "value": 0.91,
        "unit": "ratio",
        "basis": "estimated",
        "source": "fixture:evaluation",
        "scope": "synthetic evaluation"
      }
    },
    "verification": null
  }
}
